{
  "schema_version": "1.0",
  "kind": "low_quality_scanned_text",
  "title": "時間外勤務手当 申請時の確認事項（架空・低コントラスト）",
  "page_count": 1,
  "expected_full_text": "時間外勤務手当 申請時の確認事項（架空）\n文書番号: 架空人給第24号　施行日: 2026年6月1日\n1. 対象\n所属長の命令により正規の勤務時間を超えて勤務した職員を対象とする。\n2. 提出期限\n給与事務担当者は、勤務した月の翌月10日までに申請内容を確認する。\n3. 確認書類\n・時間外勤務命令簿\n・勤務実績一覧\n4. 支給額の確認\n申請額が30,000円以上の場合は、所属長確認書を添付する。\n5. 処理期限\n人事給与課は受付後5営業日以内に確認結果を所属へ通知する。\n注: 本文書はRAG評価専用の架空資料であり、実在の制度ではない。",
  "critical_values": [
    "2026年6月1日",
    "翌月10日",
    "30,000円以上",
    "5営業日以内"
  ],
  "input_characteristics": {
    "text_layer_expected": false,
    "dpi": 300,
    "rotation_degrees": 0,
    "quality": "low_quality"
  },
  "quality_assessment": {
    "degradation": "low_contrast",
    "measurement": {
      "metric": "grayscale_dynamic_range",
      "value": 56,
      "fixture_gate_max": 60
    }
  },
  "expected_gate": {
    "extraction_result": "REVIEW_REQUIRED",
    "document_status": "WAITING_REVIEW",
    "review_reasons": [
      "LOW_CONTRAST"
    ],
    "automatic_ready_allowed": false
  },
  "confidence": {
    "source": "unavailable",
    "value": null,
    "review_required": true
  },
  "pages": [
    {
      "page": 1,
      "width_points": 595.2756,
      "height_points": 841.8898,
      "source_image_sha256": "9a00a2028b4b68779610e04524c7b051f7db1daad535b6bc64d19a7920654aab",
      "expected_text": "時間外勤務手当 申請時の確認事項（架空）\n文書番号: 架空人給第24号　施行日: 2026年6月1日\n1. 対象\n所属長の命令により正規の勤務時間を超えて勤務した職員を対象とする。\n2. 提出期限\n給与事務担当者は、勤務した月の翌月10日までに申請内容を確認する。\n3. 確認書類\n・時間外勤務命令簿\n・勤務実績一覧\n4. 支給額の確認\n申請額が30,000円以上の場合は、所属長確認書を添付する。\n5. 処理期限\n人事給与課は受付後5営業日以内に確認結果を所属へ通知する。\n注: 本文書はRAG評価専用の架空資料であり、実在の制度ではない。",
      "regions": [
        {
          "id": "title",
          "text": "時間外勤務手当 申請時の確認事項（架空）",
          "bbox": {
            "x0": 0.0907,
            "y0": 0.0533,
            "x1": 0.6504,
            "y1": 0.0744
          }
        },
        {
          "id": "document_meta",
          "text": "文書番号: 架空人給第24号　施行日: 2026年6月1日",
          "bbox": {
            "x0": 0.0907,
            "y0": 0.1063,
            "x1": 0.3996,
            "y1": 0.1152
          }
        },
        {
          "id": "purpose_heading",
          "text": "1. 対象",
          "bbox": {
            "x0": 0.0907,
            "y0": 0.1887,
            "x1": 0.1508,
            "y1": 0.2007
          }
        },
        {
          "id": "purpose",
          "text": "所属長の命令により正規の勤務時間を超えて勤務した職員を対象とする。",
          "bbox": {
            "x0": 0.0907,
            "y0": 0.2161,
            "x1": 0.5964,
            "y1": 0.2266
          }
        },
        {
          "id": "deadline_heading",
          "text": "2. 提出期限",
          "bbox": {
            "x0": 0.0907,
            "y0": 0.2828,
            "x1": 0.1895,
            "y1": 0.295
          }
        },
        {
          "id": "deadline",
          "text": "給与事務担当者は、勤務した月の翌月10日までに申請内容を確認する。",
          "bbox": {
            "x0": 0.0907,
            "y0": 0.3104,
            "x1": 0.5827,
            "y1": 0.3207
          }
        },
        {
          "id": "attachments_heading",
          "text": "3. 確認書類",
          "bbox": {
            "x0": 0.0907,
            "y0": 0.3766,
            "x1": 0.1895,
            "y1": 0.3891
          }
        },
        {
          "id": "attachment_1",
          "text": "・時間外勤務命令簿",
          "bbox": {
            "x0": 0.1149,
            "y0": 0.4056,
            "x1": 0.2528,
            "y1": 0.4162
          }
        },
        {
          "id": "attachment_2",
          "text": "・勤務実績一覧",
          "bbox": {
            "x0": 0.1149,
            "y0": 0.4316,
            "x1": 0.2222,
            "y1": 0.4416
          }
        },
        {
          "id": "amount_heading",
          "text": "4. 支給額の確認",
          "bbox": {
            "x0": 0.0907,
            "y0": 0.4991,
            "x1": 0.2282,
            "y1": 0.5117
          }
        },
        {
          "id": "amount",
          "text": "申請額が30,000円以上の場合は、所属長確認書を添付する。",
          "bbox": {
            "x0": 0.0907,
            "y0": 0.5271,
            "x1": 0.5052,
            "y1": 0.5376
          }
        },
        {
          "id": "processing_heading",
          "text": "5. 処理期限",
          "bbox": {
            "x0": 0.0907,
            "y0": 0.5938,
            "x1": 0.1895,
            "y1": 0.6058
          }
        },
        {
          "id": "processing",
          "text": "人事給与課は受付後5営業日以内に確認結果を所属へ通知する。",
          "bbox": {
            "x0": 0.0907,
            "y0": 0.6212,
            "x1": 0.5282,
            "y1": 0.6314
          }
        },
        {
          "id": "note",
          "text": "注: 本文書はRAG評価専用の架空資料であり、実在の制度ではない。",
          "bbox": {
            "x0": 0.0907,
            "y0": 0.9085,
            "x1": 0.4621,
            "y1": 0.9168
          }
        }
      ]
    }
  ]
}
